924d5c6b79e7dda98b99885856199c20	art	Art for Academics	All about research and teaching	courses/art/icons/512.png	art@example.org
a6a6d797848ddbf1c440f1b35b5b6c46	businesss	Business for Beginners	Basics to start your own company	courses/business/icons/512.png	business@example.org
3eebbcc16299b6d7c0ba7725843938d2	computers	Computers for Collaboration	Co-create with current technologies	courses/computers/icons/512.png	computers@example.org
0cf9b80c425569a73f2c278c29cad8cb	dancing	Dancing for Dillitantes	Do more for your health and happiness	courses/dance/icons/512.png	dance@example.org
142d3b07760dc4242f1385b6e8c1973b	engineering	Engineering for Enthusiasts	Enhance and evolve your maker skills	courses/everything/icons/512.png	engineering@example.org
33c00ecdb2c43d426732845e6055b50e	firstaid	First-Aid for First-Responders	Full training for when it matters most	courses/firstaid/icons/512.png	firstaid@example.org
